{
  "schemaVersion": 5,
  "catalogVersion": 13,
  "defaultLocale": "en",
  "defaultRuleVersion": "catalog-13",
  "defaultReviewedAt": "2026-08-06",
  "defaultRuleProfileId": "reference.standard",
  "ruleProfiles": [
    {
      "id": "reference.standard",
      "faceHeightRatio": 0.55,
      "faceTopRatio": 0.10,
      "faceHeightTolerance": 0.05,
      "topMarginTolerance": 0.04,
      "faceHeightConstraint": "soft",
      "topMarginConstraint": "soft",
      "eyeLineRatio": 0.43,
      "eyeLineTolerance": 0.04,
      "eyeLineConstraint": "soft",
      "minFaceWidthRatio": 0.02,
      "maxHeadPoseDegrees": 15,
      "minEyeOpenProbability": 0.45,
      "headMeasurement": "crown_to_chin",
      "faceCenterXRatio": 0.5,
      "faceCenterXTolerance": 0.035,
      "faceCenterConstraint": "soft",
      "shoulderLineRatio": 0.88,
      "shoulderLineTolerance": 0.055,
      "shoulderLineConstraint": "soft",
      "maxUpscaleRatio": 1.35,
      "portraitBottomRatio": 1.0,
      "maxPortraitWidthRatio": 1.0,
      "bottomPolicy": "preserve_composition",
      "strictComposition": false
    },
    {
      "id": "reference.common_portrait",
      "faceHeightRatio": 0.68,
      "faceTopRatio": 0.08,
      "faceHeightTolerance": 0.04,
      "topMarginTolerance": 0.04,
      "faceHeightConstraint": "soft",
      "topMarginConstraint": "soft",
      "eyeLineTolerance": 0.04,
      "eyeLineConstraint": "soft",
      "minFaceWidthRatio": 0.02,
      "maxHeadPoseDegrees": 15,
      "minEyeOpenProbability": 0.45,
      "headMeasurement": "crown_to_chin",
      "faceCenterXRatio": 0.5,
      "faceCenterXTolerance": 0.035,
      "faceCenterConstraint": "soft",
      "shoulderLineRatio": 0.93,
      "shoulderLineTolerance": 0.055,
      "shoulderLineConstraint": "soft",
      "maxUpscaleRatio": 1.35,
      "portraitBottomRatio": 1.0,
      "maxPortraitWidthRatio": 1.0,
      "bottomPolicy": "preserve_composition",
      "strictComposition": false
    },
    {
      "id": "reference.square",
      "faceHeightRatio": 0.60,
      "faceTopRatio": 0.10,
      "faceHeightTolerance": 0.05,
      "topMarginTolerance": 0.04,
      "faceHeightConstraint": "soft",
      "topMarginConstraint": "soft",
      "eyeLineRatio": 0.43,
      "eyeLineTolerance": 0.04,
      "eyeLineConstraint": "soft",
      "minFaceWidthRatio": 0.02,
      "maxHeadPoseDegrees": 15,
      "minEyeOpenProbability": 0.45,
      "headMeasurement": "crown_to_chin",
      "faceCenterXRatio": 0.5,
      "faceCenterXTolerance": 0.035,
      "faceCenterConstraint": "soft",
      "shoulderLineRatio": 0.90,
      "shoulderLineTolerance": 0.055,
      "shoulderLineConstraint": "soft",
      "maxUpscaleRatio": 1.35,
      "portraitBottomRatio": 1.0,
      "maxPortraitWidthRatio": 1.0,
      "bottomPolicy": "preserve_composition",
      "strictComposition": false
    },
    {
      "id": "official.unmodified",
      "faceHeightRatio": 0.55,
      "faceTopRatio": 0.10,
      "faceHeightTolerance": 0.08,
      "topMarginTolerance": 0.06,
      "faceHeightConstraint": "soft",
      "topMarginConstraint": "soft",
      "eyeLineRatio": 0.43,
      "eyeLineTolerance": 0.06,
      "eyeLineConstraint": "soft",
      "minFaceWidthRatio": 0.02,
      "maxHeadPoseDegrees": 15,
      "minEyeOpenProbability": 0.45,
      "headMeasurement": "crown_to_chin",
      "faceCenterXRatio": 0.5,
      "faceCenterXTolerance": 0.035,
      "faceCenterConstraint": "soft",
      "shoulderLineRatio": 0.90,
      "shoulderLineTolerance": 0.065,
      "shoulderLineConstraint": "soft",
      "maxUpscaleRatio": 1.15,
      "portraitBottomRatio": 1.0,
      "maxPortraitWidthRatio": 1.25,
      "bottomPolicy": "preserve_composition",
      "strictComposition": false
    },
    {
      "id": "official.restricted",
      "faceHeightRatio": 0.55,
      "faceTopRatio": 0.10,
      "faceHeightTolerance": 0.08,
      "topMarginTolerance": 0.06,
      "faceHeightConstraint": "soft",
      "topMarginConstraint": "soft",
      "eyeLineRatio": 0.43,
      "eyeLineTolerance": 0.06,
      "eyeLineConstraint": "soft",
      "minFaceWidthRatio": 0.02,
      "maxHeadPoseDegrees": 15,
      "minEyeOpenProbability": 0.45,
      "headMeasurement": "crown_to_chin",
      "faceCenterXRatio": 0.5,
      "faceCenterXTolerance": 0.035,
      "faceCenterConstraint": "soft",
      "shoulderLineRatio": 0.90,
      "shoulderLineTolerance": 0.065,
      "shoulderLineConstraint": "soft",
      "maxUpscaleRatio": 1.35,
      "portraitBottomRatio": 1.0,
      "maxPortraitWidthRatio": 1.25,
      "bottomPolicy": "preserve_composition",
      "strictComposition": false
    }
  ],
  "documents": [
    {
      "id": "common_print_25x35",
      "regionCode": "COMMON",
      "documentType": "general",
      "regionNameKey": "region.common",
      "displayNameKey": "document.common_25x35",
      "variants": [
        {"id":"common_print_25x35_print","displayNameKey":"variant.print_300dpi","delivery":"print","ruleProfileId":"reference.common_portrait","output":{"width":"25","height":"35","unit":"mm","dimensionMode":"exact","dpi":300,"formats":["jpeg"],"colorSpace":"sRGB"},"background":{"color":"#FFFFFF"},"sourceId":"product.common_sizes","status":"reference","editPolicy":"allowed"}
      ]
    },
    {
      "id": "common_print_35x45",
      "regionCode": "COMMON",
      "documentType": "general",
      "regionNameKey": "region.common",
      "displayNameKey": "document.common_35x45",
      "variants": [
        {"id":"common_print_35x45_print","displayNameKey":"variant.print_300dpi","delivery":"print","ruleProfileId":"reference.common_portrait","output":{"width":"35","height":"45","unit":"mm","dimensionMode":"exact","dpi":300,"formats":["jpeg"],"colorSpace":"sRGB"},"background":{"color":"#FFFFFF"},"sourceId":"product.common_sizes","status":"reference","editPolicy":"allowed"}
      ]
    },
    {
      "id": "common_print_33x48",
      "regionCode": "COMMON",
      "documentType": "general",
      "regionNameKey": "region.common",
      "displayNameKey": "document.common_33x48",
      "variants": [
        {"id":"common_print_33x48_print","displayNameKey":"variant.print_300dpi","delivery":"print","ruleProfileId":"reference.common_portrait","output":{"width":"33","height":"48","unit":"mm","dimensionMode":"exact","dpi":300,"formats":["jpeg"],"colorSpace":"sRGB"},"background":{"color":"#FFFFFF"},"sourceId":"product.common_sizes","status":"reference","editPolicy":"allowed"}
      ]
    },
    {
      "id": "common_print_2x2",
      "regionCode": "COMMON",
      "documentType": "general",
      "regionNameKey": "region.common",
      "displayNameKey": "document.common_2x2",
      "variants": [
        {"id":"common_print_2x2_print","displayNameKey":"variant.print_300dpi","delivery":"print","ruleProfileId":"reference.square","output":{"width":"2","height":"2","unit":"inch","dimensionMode":"exact","dpi":300,"formats":["jpeg"],"colorSpace":"sRGB"},"background":{"color":"#FFFFFF"},"sourceId":"product.common_sizes","status":"reference","editPolicy":"allowed"}
      ]
    },
    {
      "id": "common_print_50x70",
      "regionCode": "COMMON",
      "documentType": "general",
      "regionNameKey": "region.common",
      "displayNameKey": "document.common_50x70",
      "variants": [
        {"id":"common_print_50x70_print","displayNameKey":"variant.print_300dpi","delivery":"print","ruleProfileId":"reference.common_portrait","output":{"width":"50","height":"70","unit":"mm","dimensionMode":"exact","dpi":300,"formats":["jpeg"],"colorSpace":"sRGB"},"background":{"color":"#FFFFFF"},"sourceId":"product.common_sizes","status":"reference","editPolicy":"allowed"}
      ]
    },
    {
      "id": "common_digital",
      "regionCode": "COMMON",
      "documentType": "general",
      "regionNameKey": "region.common",
      "displayNameKey": "document.common_digital",
      "variants": [
        {"id":"common_digital_square","displayNameKey":"variant.digital_600x600","delivery":"digital","ruleProfileId":"reference.square","output":{"width":"600","height":"600","unit":"px","dimensionMode":"exact","dpi":300,"formats":["jpeg"],"colorSpace":"sRGB"},"background":{"color":"#FFFFFF"},"sourceId":"product.common_sizes","status":"reference","editPolicy":"allowed"},
        {"id":"common_digital_portrait","displayNameKey":"variant.digital_600x750","delivery":"digital","ruleProfileId":"reference.common_portrait","output":{"width":"600","height":"750","unit":"px","dimensionMode":"exact","dpi":300,"formats":["jpeg"],"colorSpace":"sRGB"},"background":{"color":"#FFFFFF"},"sourceId":"product.common_sizes","status":"reference","editPolicy":"allowed"}
      ]
    },
    {
      "id": "gb_passport",
      "regionCode": "GB",
      "documentType": "passport",
      "regionNameKey": "region.gb",
      "displayNameKey": "document.gb_passport",
      "variants": [
        {"id":"gb_passport_digital","displayNameKey":"variant.digital","delivery":"digital","ruleProfileId":"official.unmodified","output":{"width":"600","height":"750","unit":"px","dimensionMode":"minimum","dpi":300,"minBytes":50000,"maxBytes":10000000,"formats":["jpeg"],"colorSpace":"sRGB"},"background":{"color":"#F2F2F2","allowedColors":["#F2F2F2","#FFFFFF"]},"composition":{"faceHeightRatio":0.7,"faceHeightRange":{"min":0.644444,"max":0.755556},"faceHeightConstraint":"hard"},"sourceIds":["gov.uk.passport_photos","gov.uk.passport_photo_requirements"],"status":"verified","editPolicy":"prohibited","capturePolicy":"self_capture_allowed","sourceImagePolicies":["original_camera_file_required"],"applicationChannels":["online"],"requirementKeys":["requirement.uk_recent_unmodified"]},